{
  "attempt": 1,
  "capability": "media.probe",
  "created_at": "2026-07-21T08:00:00Z",
  "credential_handles": [
    "ch-9f2e"
  ],
  "execution_policy": "LOCAL_PREFERRED",
  "idempotency_key": "probe-01J2ZK3AC9-1",
  "input_artifact_ids": [
    "01J2ZK3AC9V6XW8YQ4R5T6U7W1"
  ],
  "lease_expires_at": null,
  "lease_id": null,
  "output_schema_ref": null,
  "params": {
    "sample_rate": 1,
    "target": "full"
  },
  "priority": 0,
  "resource_limits": {
    "cpu_cores": 2.0,
    "gpu": null,
    "memory_mb": 2048,
    "schema_version": "1",
    "timeout_s": 600
  },
  "schema_version": "1",
  "task_id": "01J2ZK3AC9V6XW8YQ4R5T6U7W2",
  "workflow_id": null
}
